NO, PROVINSI, KABUPATEN, TIPE RS, NAMA RS, STATUS1, Nanggroe Aceh Darussalam, Kota Banda Aceh, Rumah Sakit Umum, RSU Dr. Zainoel Abidin, Paripurna2, Nanggroe Aceh Darussalam, Kab. Aceh Tengah, Rumah Sakit Umum Daerah, RSUD Datu Beru Takengon, Paripurna3, Nanggroe Aceh Darussalam, Kab. Bener Meriah, Rumah Sakit Umum Daerah, RSUD Muyang Kute Redelong, Madya4, Nanggroe Aceh Darussalam, Kab. Aceh Timur, Rumah Sakit Umum Daerah, RSUD Idi Rayeuk (RSUD dr. Zubir Mahmud), Dasar5, Nanggroe Aceh Darussalam, Kab. Pidie, Rumah Sakit Umum Daerah, RSUD TGK Chik Ditiro Sigli, Dasar6, Sumatera Utara, Kota Medan, Rumah Sakit Umum, RS H. Adam Malik, Paripurna7, Sumatera Utara, Kota Medan, Rumah Sakit Umum, RSU Dr Pirngadi, Utama8, Sumatera Utara, Kab.Deli Serdang, Rumah Sakit Umum Daerah, RSUD Deli Serdang, Utama9, Sumatera Utara, Kota Tebing Tinggi, Rumah Sakit Umum Daerah, RSUD Dr. H.Kumpulan Pane, Dasar10, Sumatera Utara, Tapanuli Tengah, Rumah Sakit Umum Daerah, RSUD Pandan, Perdana11, Sumatera Barat, Kota Padang, Rumah Sakit Umum, RS Dr. M. Djamil, Paripurna12, Sumatera Barat, Kota Padang, Rumah Sakit Jiwa, RS Jiwa Prof.Dr. Hasan Basri Saanin Datuk Tan Pari, Paripurna13, Sumatera Barat, Kota Bukittinggi, Rumah Sakit Umum Daerah, RSUD Dr. Achmad Mochtar, Paripurna14, Sumatera Barat, Kota Solok, Rumah Sakit Umum Daerah, RSUD Solok, Utama15, Sumatera Barat, Kab. Sijunjung, Rumah Sakit Umum Daerah, RSUD Kab Sijunjung, Perdana16, Riau, Kab. Bengkalis, Rumah Sakit Umum Daerah, RSUD Kec.Mandau, Utama17, Riau, Kota Pekanbaru, Rumah Sakit Umum Daerah, RSUD Petala Bumi, Perdana18, Riau, Kota Pekanbaru, Rumah Sakit Jiwa, RS Jiwa Tampan, Paripurna19, Riau, Kab. Pelalawan, Rumah Sakit Umum Daerah, RSUD Selasih Riau, Dasar20, Riau, Kab. Kepulauan Meranti, Rumah Sakit Umum Daerah, RSUD Kab. Kepulauan Meranti, Perdana21, Jambi, Kota Jambi, Rumah Sakit Umum, RSU Raden Mattaher Jambi, Paripurna22, Jambi, Kota Jambi, Rumah Sakit Umum Daerah, RSUD H. Abdul Manap, Madya23, Jambi, Kota Jambi, Rumah Sakit Jiwa, RS Jiwa Jambi, Madya24, Jambi, Kab. Bungo, Rumah Sakit Umum Daerah, RSUD H. Hanafi/Muara Bungo, Madya25, Jambi, Kab. Sarolangun, Rumah Sakit Umum Daerah, RSUD Prof.DR.H.M.Chatib Quzwain, Perdana26, Jambi, Kab. Tanjung Jabung Timur, Rumah Sakit Umum, RSU Nurdin Hamzah, Perdana27, Jambi, Kab. Tebo, Rumah Sakit Umum Daerah, RSUD Sultan Taha Saifudin, Perdana28, Sumatera Selatan, Kota Palembang, Rumah Sakit Umum Daerah, RSUD Palembang Bari, Paripurna29, Sumatera Selatan, Kota Palembang, Rumah Sakit Umum, RS Dr. Mohammad Hoesin, Paripurna30, Sumatera Selatan, Kota Prabumulih, Rumah Sakit Umum Daerah, RSUD Prabumulih, Utama31, Sumatera Selatan, Kab. Ogan Komering Ulu, Rumah Sakit Umum Daerah, RSUD Dr. Ibnu Sutowo Baturaja, Utama32, Sumatera Selatan, Kab. Musi Banyuasin, Rumah Sakit Umum Daerah, RSUD Sekayu, Madya33, Sumatera Selatan, Kab. Ogan Komering Ulu Timur, Rumah Sakit Umum Daerah, RSUD Oku Timur (Gumawang), Perdana34, Bengkulu, Kota Bengkulu, Rumah Sakit Umum Daerah, RSUD Dr M Yunus Bengkulu, Paripurna35, Bengkulu, Kota Bengkulu, Rumah Sakit Umum Daerah, RSUD KOTA BENGKULU, Perdana36, Bengkulu, Kab Kepahiang, Rumah Sakit Umum Daerah, RSUD Kepahiang, Perdana37, Bengkulu, Kab. Bengkulu Utara, Rumah Sakit Umum Daerah, RSUD Arga Makmur, Perdana38, Lampung, Kota Metro, Rumah Sakit Umum Daerah, RSUD Ahmad Yani,Metro, Paripurna39, Lampung, Kota Bandar Lampung, Rumah Sakit Umum Daerah, RSUD Dr H Abdul Moeloek, Paripurna40, Lampung, Kab. Tulang Bawang, Rumah Sakit Umum Daerah, RSUD Menggala Tulang Bawang, Madya41, Lampung, Kab. Lampung Timur, Rumah Sakit Umum Daerah, RSUD Sukadana, Perdana42, DKI Jakarta, Jakarta Selatan, Rumah Sakit Umum, RS Ketergantungan Obat, Madya43, DKI Jakarta, Jakarta Selatan, Rumah Sakit Umum, RSU Kecamatan Mampang Prapatan, Perdana44, DKI Jakarta, Jakarta Selatan, Rumah Sakit Umum, RSU Kecamatan Jagakarsa, Perdana45, DKI Jakarta, Jakarta Selatan, Rumah Sakit Umum, RSU Kecamatan Pesanggrahan, Perdana46, DKI Jakarta, Jakarta Selatan, Rumah Sakit Umum, RSU Kecamatan Tebet, Perdana47, DKI Jakarta, Jakarta Barat, Rumah Sakit Umum Daerah, RSUD Cengkareng, Paripurna48, DKI Jakarta, Jakarta Barat, Rumah Sakit Jiwa, RS Jiwa Dr. Soeharto Heerjan, Utama49, DKI Jakarta, Jakarta Barat, Rumah Sakit Umum, RSU Kecamatan Kembangan, Perdana50, DKI Jakarta, Jakarta Barat, Rumah Sakit Umum, RSU Kecamatan Kalideres, Perdana51, DKI Jakarta, Kota Jakarta Pusat, Rumah Sakit Umum, RSU Kecamatan Johar Baru, Perdana52, DKI Jakarta, Kota Jakarta Pusat, Rumah Sakit Umum, RS Dr. Cipto Mangunkusumo, Paripurna53, DKI Jakarta, Kota Jakarta Pusat, Rumah Sakit Umum, RSU Tarakan, Paripurna54, DKI Jakarta, Kota Jakarta Pusat, Rumah Sakit Umum, RSU Kecamatan Cempaka Putih, Perdana55, DKI Jakarta, Kota Jakarta Pusat, Rumah Sakit Umum, RSU Kecamatan Kemayoran, Perdana56, DKI Jakarta, Kota Jakarta Pusat, Rumah Sakit Umum, RSU Kecamatan Sawah Besar, Perdana57, DKI Jakarta, Jakarta Utara, Rumah Sakit Umum, RS Penyakit Infeksi Prof. Dr.Sulianti Saroso, Utama58, DKI Jakarta, Jakarta Utara, Rumah Sakit Umum, RSU Kecamatan Koja, Perdana59, DKI Jakarta, Jakarta Utara, Rumah Sakit Umum, RSU Kecamatan Pademangan, Perdana60, DKI Jakarta, Jakarta Utara, Rumah Sakit Umum, RSU Kecamatan Cilincing, Perdana61, Jawa Barat, Kota Cirebon, Rumah Sakit Umum Daerah, RSUD Gunung Jati, Paripurna62, Jawa Barat, Kab.Cirebon, Rumah Sakit Umum Daerah, RSUD Waled, Paripurna63, Jawa Barat, Kota Cimahi, Rumah Sakit Umum, RSU Cibabat, Paripurna64, Jawa Barat, Kab. Bandung Barat, Rumah Sakit Jiwa, RS Jiwa Provinsi Jawa Barat, Paripurna65, Jawa Barat, Kab. Sumedang, Rumah Sakit Umum Daerah, RSUD Sumedang, Paripurna66, Jawa Barat, Kota Bandung, Rumah Sakit Khusus, RSK Ibu & Anak Kota Bandung, Paripurna67, Jawa Barat, Kota Bandung, Rumah Sakit Umum, RS Dr. Hasan Sadikin, Paripurna68, Jawa Barat, Kota Bandung, Rumah Sakit Umum Daerah, RSUD Ujung Berung, Utama69, Jawa Barat, Kota Bandung, Rumah Sakit Khusus, RSK Gigi dan Mulut Kota Bandung, Perdana70, Jawa Barat, Kota Bogor, Rumah Sakit Jiwa, RS Jiwa Dr. H. Marzoeki Mahdi, Paripurna71, Jawa Barat, Kab. Bogor, Rumah Sakit Umum Daerah, RSUD Cibinong, Paripurna72, Jawa Barat, Kab. Bogor, Rumah Sakit Umum, RSU Ciawi, Madya73, Jawa Barat, Kab. Bogor, Rumah Sakit Umum Daerah, RSUD CILEUNGSI KAB. BOGOR, Perdana74, Jawa Barat, Kab. Sukabumi, Rumah Sakit Umum Daerah, RSUD Sekarwangi, Paripurna75, Jawa Barat, Kab. Sukabumi, Rumah Sakit Umum Daerah, RSUD Jampang Kulon, Perdana76, Jawa Barat, Kab. Sukabumi, Rumah Sakit Umum Daerah, RSUD Pelabuhan Ratu, Utama77, Jawa Barat, Kab. Karawang, Rumah Sakit Umum Daerah, RSUD Karawang, Paripurna78, Jawa Barat, Kota Sukabumi, Rumah Sakit Umum Daerah, RSUD R Syamsudin SH, Paripurna79, Jawa Barat, Kota Bekasi, Rumah Sakit Umum Daerah, RSUD Bekasi, Utama80, Jawa Barat, Kab. Bandung, Rumah Sakit Umum Daerah, RSUD Al Ihsan Provinsi Jawa Barat, Utama81, Jawa Barat, Kab. Bandung, Rumah Sakit Umum Daerah, RSUD Majalaya, Utama82, Jawa Barat, Kota Depok, Rumah Sakit Umum Daerah, RSUD Kota Depok, Madya83, Jawa Barat, Kab. Cianjur, Rumah Sakit Umum Daerah, RSUD Cimacan, Perdana84, Jawa Tengah, Kab. Rembang, Rumah Sakit Umum Daerah, RSUD dr. R. Soetrasno Rembang, Paripurna85, Jawa Tengah, Kota Surakarta, Rumah Sakit Umum, RSU Dr. Moewardi Surakarta, Paripurna86, Jawa Tengah, Kota Surakarta, Rumah Sakit Jiwa, RS Jiwa Surakarta, Paripurna87, Jawa Tengah, Kota Semarang, Rumah Sakit Umum Daerah, RSUD Tugurejo Semarang, Paripurna88, Jawa Tengah, Kota Semarang, Rumah Sakit Jiwa, RS Jiwa dr. Amino Gondohutomo, Paripurna89, Jawa Tengah, Kota Semarang, Rumah Sakit Umum, RS Dr. Kariadi, Paripurna90, Jawa Tengah, Kota Semarang, Rumah Sakit Umum Daerah, RSUD Kota Semarang, Paripurna91, Jawa Tengah, Kab. Klaten, Rumah Sakit Jiwa, "RS Jiwa Dr.R.M.SoedjarwadiKlaten", Paripurna92, Jawa Tengah, Kab. Klaten, Rumah Sakit Umum, RS dr. Soeradji Tirtonegoro, Paripurna93, Jawa Tengah, Kota Salatiga, Rumah Sakit Umum, RS Paru dr. Ario Wirawan*, Paripurna94, Jawa Tengah, Kab.Banyumas, Rumah Sakit Umum Daerah, RSUD Prof Dr. M Soekarjo, Paripurna95, Jawa Tengah, Kab.Banyumas, Rumah Sakit Umum Daerah, RSUD Banyumas, Utama96, Jawa Tengah, Kab.Wonosobo, Rumah Sakit Umum, RSU Wonosobo, Paripurna97, Jawa Tengah, Kab.Semarang, Rumah Sakit Umum Daerah, RSUD Ambarawa, Paripurna98, Jawa Tengah, Kab.Semarang, Rumah Sakit Umum Daerah, RSUD Ungaran, Paripurna99, Jawa Tengah, Kota Tegal, Rumah Sakit Umum Daerah, RSUD Kardinah, Utama100, Jawa Tengah, Kab. Tegal, Rumah Sakit Umum, RSU Dr. H.RM Soeselo W, Paripurna101, Jawa Tengah, Kab. Boyolali, Rumah Sakit Umum Daerah, RSUD Pandan Arang Boyolali, Paripurna102, Jawa Tengah, Kab. Boyolali, Rumah Sakit Umum Daerah, RSUD Simo, Perdana103, Jawa Tengah, Kab. Wonogiri, Rumah Sakit Umum Daerah, RSUD Dr. Soediran MS Wonogiri, Paripurna104, Jawa Tengah, Kab. Purworejo, Rumah Sakit Umum Daerah, RSUD dr. Tjitrowardojo Purworejo, Utama105, Jawa Tengah, Kab. Pekalongan, Rumah Sakit Umum Daerah, RSUD Kraton Kab. Pekalongan, Paripurna106, Jawa Tengah, Kab. Pekalongan, Rumah Sakit Umum Daerah, RSUD Kajen Kab. Pekalongan, Utama107, Jawa Tengah, Kab. Pemalang, Rumah Sakit Umum Daerah, RSUD Dr. M Ashasi Pemalang, Utama108, Jawa Tengah, Kab. Kudus, Rumah Sakit Umum Daerah, RSUD dr. Loekmono Hadi, Utama109, Jawa Tengah, Kab. Banjarnegara, Rumah Sakit Umum Daerah, RSUD Hj. ANNA LASMANAH, Utama110, Jawa Tengah, Kota Magelang, Rumah Sakit Umum Daerah, RSUD Tidar, Utama111, Jawa Tengah, Kab. Magelang, Rumah Sakit Umum Daerah, RSUD Muntilan, Madya112, Jawa Tengah, Kab. Jepara, Rumah Sakit Umum Daerah, RSUD Kelet Provinsi Jawa Tengah, Paripurna113, Jawa Tengah, Kab. Jepara, Rumah Sakit Umum Daerah, RSUD R. A. Kartini, Paripurna114, Jawa Tengah, Kab. Pati, Rumah Sakit Umum Daerah, RSUD RAA Soewondo, Paripurna115, Jawa Tengah, Kab. Kebumen, Rumah Sakit Umum Daerah, RSUD Kebumen, Paripurna116, Jawa Tengah, Kab. Purbalingga, Rumah Sakit Umum Daerah, "RSUD dr. R. GOETENGTAROENADIBRATA", Paripurna117, Jawa Tengah, Kab. Sukoharjo, Rumah Sakit Umum, "RS Orthopedi Prof. Dr. R.Soeharso", Paripurna118, Jawa Tengah, Kab. Sukoharjo, Rumah Sakit Umum Daerah, RSUD Sukoharjo, Paripurna119, Jawa Tengah, Kab. Cilacap, Rumah Sakit Umum, RSU Cilacap, Paripurna120, Jawa Tengah, Kab. Demak, Rumah Sakit Umum, RSU Sunan Kalijaga, Paripurna121, Jawa Tengah, Kab. Kendal, Rumah Sakit Umum Daerah, RSUD Dr. H. Soewondo Kendal, Paripurna122, Jawa Tengah, Kab. Batang, Rumah Sakit Umum Daerah, RSUD Kab. Batang, Paripurna123, Jawa Tengah, Kab. Sragen, Rumah Sakit Umum Daerah, RSUD dr. Soehadi Prijonegoro, Paripurna124, Yogyakarta, Kab. Bantul, Rumah Sakit Umum Daerah, RSUD Panembahan Senopati, Paripurna125, Yogyakarta, Kab. Sleman, Rumah Sakit Jiwa, RS Jiwa Ghrasia, Paripurna126, Yogyakarta, Kab. Sleman, Rumah Sakit Umum Daerah, RSUD Prambanan, Paripurna127, Yogyakarta, Kab. Sleman, Rumah Sakit Umum, RS Dr. Sardjito, Paripurna128, Yogyakarta, Kab. Sleman, Rumah Sakit Umum Daerah, RSUD Sleman, Paripurna129, Yogyakarta, Kab. Kulon Progo, Rumah Sakit Umum Daerah, RSUD Wates, Paripurna130, Yogyakarta, Kota Yogyakarta, Rumah Sakit Umum Daerah, RSUD Kota Yogyakarta, Utama131, Yogyakarta, Kota Yogyakarta, Rumah Sakit Umum, RS Paru Respira Yogyakarta, Perdana132, Yogyakarta, Gunung Kidul, Rumah Sakit Umum Daerah, RSUD Wonosari, Paripurna133, Jawa Timur, Kab.Sidoarjo, Rumah Sakit Umum Daerah, RSUD Sidoarjo, Paripurna134, Jawa Timur, Kota Malang, Rumah Sakit Umum, RSU Dr. Saiful Anwar, Paripurna135, Jawa Timur, Kab.Tulungagung, Rumah Sakit Umum Daerah, RSUD dr. Iskak Tulungagung, Paripurna136, Jawa Timur, Kota Madiun, Rumah Sakit Umum, RSU Dr. Soedono Madiun, Paripurna137, Jawa Timur, Kota Madiun, Rumah Sakit Umum Daerah, RSUD Kota Madiun, Paripurna138, Jawa Timur, Kab. Ponorogo, Rumah Sakit Umum Daerah, RSUD Dr. Harjono S Ponorogo, Paripurna139, Jawa Timur, Kota Mojokerto, Rumah Sakit Umum, RSU Dr. Wahidin S Husodo, Paripurna140, Jawa Timur, Kab. Pacitan, Rumah Sakit Umum Daerah, RSUD dr. Darsono, Paripurna141, Jawa Timur, Kab. Banyuwangi, Rumah Sakit Umum Daerah, RSUD Genteng, Paripurna142, Jawa Timur, Kota Surabaya, Rumah Sakit Umum, RSU Dr. Soetomo, Paripurna143, Jawa Timur, Kota Surabaya, Rumah Sakit Umum, RSU Haji Surabaya, Paripurna144, Jawa Timur, Kota Surabaya, Rumah Sakit Jiwa, RS Jiwa Menur, Paripurna145, Jawa Timur, Kota Surabaya, Rumah Sakit Umum Daerah, RSUD Dr. Mohamad Soewandhie, Utama146, Jawa Timur, Kota Surabaya, Rumah Sakit Umum Daerah, RSUD Bhakti Dharma Husada, Utama147, Jawa Timur, Kota Surabaya, Rumah Sakit Umum, RS Khusus Paru Surabaya, Perdana148, Jawa Timur, Kab. Mojokerto, Rumah Sakit Umum Daerah, RSUD Prof. Dr. Soekandar, Paripurna149, Jawa Timur, Kab. Mojokerto, Rumah Sakit Umum Daerah, RSUD RA. Basoeni, Utama150, Jawa Timur, Kab. Mojokerto, Rumah Sakit Umum, RS Kusta Sumberglagah, Utama151, Jawa Timur, Kab. Jombang, Rumah Sakit Umum Daerah, RSUD Kab Jombang, Utama152, Jawa Timur, Kab. Pamekasan, Rumah Sakit Umum Daerah, RSUD Dr. H. Slamet Martodirdjo, Utama153, Jawa Timur, Kab. Pamekasan, Rumah Sakit Umum Daerah, RSUD Asy-Syaafi Pamekasan, Perdana154, Jawa Timur, Kota Probolinggo, Rumah Sakit Umum, RSU Dr. Moh Saleh Probolinggo, Utama155, Jawa Timur, Kab. Jember, Rumah Sakit Umum, RSU Dr. Soebandi, Utama156, Jawa Timur, Kab.Gresik, Rumah Sakit Umum Daerah, RSUD Ibnu Sina Kab. Gresik, Madya157, Jawa Timur, Kota Kediri, Rumah Sakit Umum Daerah, RSUD Gambiran, Paripurna158, Jawa Timur, Kota Kediri, Rumah Sakit Umum, RS Kusta Kediri, Perdana159, Jawa Timur, Kab. Bangkalan, Rumah Sakit Umum Daerah, RSUD Syarifah Ambami Rato Ebu, Utama160, Jawa Timur, Kab. Blitar, Rumah Sakit Umum Daerah, RSUD Ngudi Waluyo Wlingi, Paripurna161, Jawa Timur, Kab. Tuban, Rumah Sakit Umum Daerah, RSUD Dr. R Koesma Tuban, Paripurna162, Jawa Timur, Kab. Bondowoso, Rumah Sakit Umum Daerah, RSUD Dr. H.Koesnadi, Paripurna163, Jawa Timur, Kab. Magetan, Rumah Sakit Umum Daerah, RSUD Dr. Saydiman Magetan, Paripurna164, Jawa Timur, Kab. Pasuruan, Rumah Sakit Umum Daerah, RSUD Bangil, Paripurna165, Jawa Timur, Kab. Kediri, Rumah Sakit Umum Daerah, RSUD Kabupaten Kediri, Paripurna166, Jawa Timur, Trenggalek, Rumah Sakit Umum Daerah, RSUD dr. Soedomo Trenggalek, Paripurna167, Jawa Timur, Kab. Lamongan, Rumah Sakit Umum Daerah, RSUD Dr Soegiri Lamongan, Paripurna168, Jawa Timur, Kab. Lamongan, Rumah Sakit Umum Daerah, RSUD Ngimbang, Perdana169, Jawa Timur, Kab. Sampang, Rumah Sakit Umum Daerah, RSUD Kab. Sampang, Utama170, Jawa Timur, Kab. Malang, Rumah Sakit Umum, "RSU ""Kanjuruhan"" Kepanjen", Utama171, Jawa Timur, Kab. Malang, Rumah Sakit Umum Daerah, RSUD Lawang, Perdana172, Kalimantan Barat, Kota Pontianak, Rumah Sakit Umum, RSU Dr Sudarso PTK, Paripurna173, Kalimantan Barat, Kota Pontianak, Rumah Sakit Umum Daerah, RSUD Sultan Syarif Mohamad Alkadrie, Dasar174, Kalimantan Barat, Kota Singkawang, Rumah Sakit Umum Daerah, RSUD Dr Abdul Aziz, Paripurna175, Kalimantan Barat, Ketapang, Rumah Sakit Umum Daerah, RSUD dr. Agoesdjam Ketapang, Utama176, Kalimantan Barat, Kab. Landak, Rumah Sakit Umum Daerah, RSUD Landak, Perdana177, Kalimantan Barat, Kab. Sanggau, Rumah Sakit Umum, RSU Sanggau, Perdana178, Kalimantan Tengah, Kab. Kapuas, Rumah Sakit Umum Daerah, RSUD Dr H Soemarno S, Dasar179, Kalimantan Tengah, Kota Palangkaraya, Rumah Sakit Jiwa, RS Jiwa Kalawa Atei, Perdana180, Kalimantan Tengah, Kab. Seruyan, Rumah Sakit Umum Daerah, RSUD Kuala Pembuang, Perdana181, Kalimantan Tengah, Kab. Murung Raya, Rumah Sakit Umum Daerah, RSUD Puruk Cahu, Perdana182, Kalimantan Tengah, Kab. Gunung Mas, Rumah Sakit Umum Daerah, RSUD Kuala Kurun, Perdana183, Kalimantan Tengah, Kab. Sukamara, Rumah Sakit Umum Daerah, RSUD Sukamara, Perdana184, Kalimantan Tengah, Kab. Katingan, Rumah Sakit Umum Daerah, RSUD MAS AMSYAR KASONGAN, Perdana185, Kalimantan Selatan, Kota Banjarmasin, Rumah Sakit Umum Daerah, RSUD Dr.H.Moch.Ansari Saleh, Paripurna186, Kalimantan Selatan, Kota Banjarmasin, Rumah Sakit Umum Daerah, RSUD Ulin Banjarmasin, Paripurna187, Kalimantan Selatan, Kab. Hulu Sungai Selatan, Rumah Sakit Umum, RSU Brigjen H Hasan Basry, Paripurna188, Kalimantan Selatan, Kab. Banjar, Rumah Sakit Umum Daerah, RSUD Ratu Zalecha, Utama189, Kalimantan Selatan, Kab. Tanah Laut, Rumah Sakit Umum Daerah, RSUD H Boejasin Pelaihari, Madya190, Kalimantan Selatan, Kab. Tapin, Rumah Sakit Umum, RSU Datu Sanggul Rantau, Perdana191, Kalimantan Timur, Kota Balikpapan, Rumah Sakit Umum Daerah, RSUD Dr. Kanujoso Djatiwibowo, Paripurna192, Kalimantan Timur, Kab. Kutai Timur, Rumah Sakit Umum Daerah, RSUD Kudungga, Utama193, Kalimantan Timur, Kota Samarinda, Rumah Sakit Jiwa, "RS Jiwa AtmamahusadaMahakam/Samarinda", Paripurna194, Kalimantan Timur, Kota Samarinda, Rumah Sakit Umum Daerah, RSUD H A Wahab Sjahranie, Utama195, Kalimantan Timur, Kota Samarinda, Rumah Sakit Umum Daerah, RSUD Inche Abdoel Moeis, Dasar196, Kalimantan Timur, Kab. Kutai Kartanegara, Rumah Sakit Umum Daerah, RSUD AM Parikesit Tenggarong, Paripurna197, Kalimantan Timur, Kab. Kutai Kartanegara, Rumah Sakit Umum Daerah, RSUD Dayaku Raja, Perdana198, Sulawesi Utara, Kota Manado, Rumah Sakit Umum, RS Prof. Dr. R. D. Kandou, Paripurna199, Sulawesi Utara, Kab. Minahasa Utara, Rumah Sakit Umum Daerah, RSUD Maria Walanda Maramis, Perdana200, Sulawesi Utara, Kepulauan Talaud, Rumah Sakit Umum Daerah, RSUD Talaud, Perdana201, Sulawesi Utara, Kab. Minahasa, Rumah Sakit Umum, RSU Dr.Sam Ratulangi, Perdana202, Sulawesi Utara, Kab. Minahasa, Rumah Sakit Umum, RSU Noongan, Perdana203, Sulawesi Utara, Kepulauan Sangihe, Rumah Sakit Umum, RSU Liun Kendage, Dasar204, Sulawesi Utara, Kota Kotamobagu, Rumah Sakit Umum Daerah, RSUD Kota Kotamobagu, Perdana205, Sulawesi Utara, Kepulauan Siau Tagulandang Biaro, Rumah Sakit Umum Daerah, RSUD Tagulandang, Perdana206, Sulawesi Utara, Kab. Minahasa Tenggara, , RSUP Ratatotok - Buyat, Perdana207, Sulawesi Tengah, Kab. Parigi Moutong, Rumah Sakit Umum, RSU Anuntaloko Parigi, Utama208, Sulawesi Tengah, Kab. Banggai, Rumah Sakit Umum, RSU Luwuk, Madya209, Sulawesi Tengah, Kota Palu, Rumah Sakit Umum, RSU Undata Palu, Paripurna210, Sulawesi Tengah, Kab. Buol, Rumah Sakit Umum, RSU Buol, Perdana211, Sulawesi Tengah, Kab. Morowali, Rumah Sakit Umum Daerah, RSUD Morowali, Perdana212, Sulawesi Selatan, Kab. Sinjai, Rumah Sakit Umum, RSU Sinjai, Dasar213, Sulawesi Selatan, Kab. Luwu Timur, Rumah Sakit Umum Daerah, RSUD I Lagaligo, Perdana214, Sulawesi Selatan, Kab. Wajo, Rumah Sakit Umum Daerah, RSUD Siwa, Perdana215, Sulawesi Selatan, Kota Makassar, Rumah Sakit Umum, RS dr. Wahidin Sudirohusodo, Paripurna216, Sulawesi Selatan, Kota Makassar, Rumah Sakit Umum, "RS Kusta Dr. Tadjuddin Chalid,MPH", Dasar217, Sulawesi Selatan, Kota Makassar, Rumah Sakit Umum Daerah, RSUD KOTA MAKASSAR, Dasar218, Sulawesi Selatan, Kab. Sidenreng Rappang, Rumah Sakit Umum, RSU Sayang Rakyat, Perdana219, Sulawesi Selatan, , Rumah Sakit Umum Daerah, RSUD Arifin Numang, Perdana220, Sulawesi Selatan, Kab. Sidenreng Rappang, Rumah Sakit Umum, RSU Nene Mallomo, Perdana221, Sulawesi Selatan, Kab. Barru, Rumah Sakit Umum, RSU Barru, Perdana222, Sulawesi Selatan, Kab. Bone, Rumah Sakit Umum, RSU Tenriawaru Bone, Utama223, Sulawesi Selatan, Kab. Kepulauan Selayar, Rumah Sakit Umum Daerah, "RSUD KH Hayyung KepulauanSelayar", Perdana224, Sulawesi Selatan, Kab. Enrekang, Rumah Sakit Umum, RSU Enrekang, Perdana225, Sulawesi Tenggara, Kota Kendari, Rumah Sakit Umum, RSU Bahteramas Provinsi Sultra, Paripurna226, Sulawesi Tenggara, Kab. Kolaka, Rumah Sakit Umum, RSU Benyamin Guluh Kolaka, Perdana227, Bali, Kab. Badung, Rumah Sakit Umum Daerah, RSUD Kab. Badung Mangusada, Paripurna228, Bali, Kab. Tabanan, Rumah Sakit Umum, RSU Tabanan, Paripurna229, Bali, Kota Denpasar, Rumah Sakit Umum Daerah, RSUD Wangaya, Paripurna230, Bali, Kota Denpasar, Rumah Sakit Umum, RS Sanglah Bali, Paripurna231, Bali, Kota Denpasar, Rumah Sakit Umum, RS Khusus Mata Bali Mandara, Paripurna232, Bali, Kab. Karangasem, Rumah Sakit Umum Daerah, RSUD Karangasem, Paripurna233, Bali, Kab. Bangli, Rumah Sakit Jiwa, RS Jiwa Provinsi Bali, Paripurna234, Bali, Kab. Bangli, Rumah Sakit Umum, RSU Bangli, Utama235, Bali, Kab. Jembrana, Rumah Sakit Umum, RSU Negara, Madya236, Bali, Kab. Gianyar, Rumah Sakit Umum Daerah, RSUD Sanjiwani Gianyar, Madya237, Bali, Kab. Buleleng, Rumah Sakit Umum Daerah, RSUD Kab. Buleleng, Madya238, Bali, Kab. Klungkung, Rumah Sakit Umum, RSU Klungkung, Paripurna239, Bali, Kab. Badung, Rumah Sakit Umum Daerah, RSUD Kab. Badung Mangusada, Paripurna240, Nusa Tenggara Barat, Kab. Lombok Barat, Rumah Sakit Umum Daerah, RSUD Patut Patuh Patju, Perdana241, Nusa Tenggara Barat, Kota Mataram, Rumah Sakit Jiwa, RS Jiwa Propinsi NTB, Paripurna242, Nusa Tenggara Barat, Kota Mataram, Rumah Sakit Umum Daerah, RSUD Kota Mataram, Utama243, Nusa Tenggara Barat, Kab. Bima, Rumah Sakit Umum, RSU Bima, Perdana244, Nusa Tenggara Barat, Kab. Sumbawa Barat, Rumah Sakit Umum Daerah, RSUD Asy-Syifa Sumbawa Barat, Perdana245, Nusa Tenggara Timur, Kota Kupang, Rumah Sakit Umum, RSU Prof Dr WZ Johanes, Madya246, Nusa Tenggara Timur, Kab. Sikka, Rumah Sakit Umum, RSU Dr TC Hillers Maumere, Madya247, Nusa Tenggara Timur, Kab. Ende, Rumah Sakit Umum Daerah, RSUD Ende, Madya248, Nusa Tenggara Timur, Kab. Ngada, Rumah Sakit Umum, RSU Bajawa, Perdana249, Nusa Tenggara Timur, Kab. Alor, Rumah Sakit Umum Daerah, RSUD Alor, Perdana250, Nusa Tenggara Timur, Kab. Kupang, Rumah Sakit Umum Daerah, RSUD Naibonat, Perdana251, Nusa Tenggara Timur, Kab. Lembata, Rumah Sakit Umum Daerah, RSUD Lewoleba, Perdana252, Nusa Tenggara Timur, Kab. Timor Tengah Selatan, Rumah Sakit Umum, RSU Soe, Perdana253, Maluku, Kota Ambon, Rumah Sakit Umum, RSU Dr M Haulussy Ambon, Utama254, Maluku, Kab.Maluku Tengah, Rumah Sakit Umum, RSU Tulehu, Perdana255, Maluku, Kab.Maluku Tengah, Rumah Sakit Umum, RSU Masohi, Perdana256, Maluku, Kab. Maluku Tenggara Barat, Rumah Sakit Umum, RSU Karel Sadsuitubun, Dasar257, Maluku Utara, Kab. Halmahera Barat, Rumah Sakit Umum Daerah, RSUD Tobelo, Perdana258, Maluku Utara, Halmahera Tengah, Rumah Sakit Umum, RSU Kota Tidore Kepulauan, Perdana259, Banten, Kota Tangerang, Rumah Sakit Umum, RS Kusta Dr. Sitanala, Paripurna260, Banten, Kab. Tangerang, Rumah Sakit Umum, RSU Tangerang, Paripurna261, Banten, Kab. Tangerang, Rumah Sakit Umum Daerah, RSUD Balaraja, Perdana262, Banten, Kota Serang, Rumah Sakit Umum Daerah, RSUD Banten, Paripurna263, Banten, Kab. Serang, Rumah Sakit Umum Daerah, RSUD Dr. Dradjat Prawiranegara, Utama264, Bangka Belitung, Kota Pangkal Pinang, Rumah Sakit Umum Daerah, RSUD Depati Hamzah, Madya265, Bangka Belitung, Kab. Bangka Barat, Rumah Sakit Umum Daerah, RSUD Sejiran Setason, Perdana266, Bangka Belitung, Kab. Bangka, Rumah Sakit Umum Daerah, RSUD Dr. (H.C.) Ir. SOEKARNO, Perdana267, Bangka Belitung, Kab. Bangka Tengah, Rumah Sakit Umum Daerah, RSUD Kab.Bangka Tengah, Perdana268, Bangka Belitung, Kab. Belitung, Rumah Sakit Umum Daerah, RSUD dr. H. Marsidi Judono, Perdana269, Gorontalo, Kab. Pohuwato, Rumah Sakit Umum Daerah, RSUD Bumi Panua, Perdana270, Kepulauan Riau, Kota Batam, Rumah Sakit Umum Daerah, RSUD Embung Fatimah, Paripurna271, Kepulauan Riau, Kab. Bintan, Rumah Sakit Umum Daerah, RSUD Tanjung Uban, Paripurna272, Papua Barat, Kab. Sorong Selatan, Rumah Sakit Umum, RSU SCHOLOO Keyen, Perdana273, Papua Barat, Kab. Teluk Bintuni, Rumah Sakit Umum, RSU Bintuni, Perdana274, Sulawesi Barat, Kab. Mamuju, Rumah Sakit Umum Daerah, RSUD Provinsi Sulawesi Barat, Perdana
